{
  "schema_id": "EntryDetailExtraction",
  "schema_version": "1.0",
  "data": {
    "entryHeader": {
      "entryTypeCode": "67",
      "operType": "RG",
      "mnlFileInd": "Y",
      "entrdThruPortId": 1000,
      "mfgFirmFeiNum": 1,
      "entryDate": "2025-10-16",
      "product": {
        "industryCode": "01",
        "classCode": "U",
        "groupCode": "00",
        "gpiCode": "UN",
        "productDesc": "UNKNOWN",
        "productId": 177487
      }
    },
    "entryAddress": [
      {
        "entryAddrType": "Return Addressee",
        "name": "UNKNOWN",
        "line1Adrs": "UNKNOWN",
        "cityName": "UNKNOWN",
        "stateCode": "??",
        "isoCntryCode": "??",
        "zipCode": "00000"
      },
      {
        "entryAddrType": null,
        "name": "UNKNOWN",
        "line1Adrs": "UNKNOWN",
        "cityName": "UNKNOWN",
        "stateCode": "??",
        "isoCntryCode": "??",
        "zipCode": "00000"
      }
    ],
    "lines": [
      {
        "descriptionOfGoods": "UNKNOWN",
        "quantity": [
          {
            "value": 1,
            "unitOfMsrCode": "PK"
          },
          {
            "value": 1,
            "unitOfMsrCode": "LB"
          }
        ],
        "unitOfMsrCode": "LB"
      }
    ],
    "total": {
      "totalQty": 1.0,
      "valueGoodsAmt": 0.01
    }
  },
  "meta": {
    "agent_version": "v1",
    "model": "gemma3:12b",
    "generated_at": "2025-10-16T20:39:09.546324+00:00",
    "job_id": "4e190c9b-88d2-41c0-8454-9c91f3be9d09",
    "overall_confidence": 0.5,
    "validation": {
      "schema_ok": true,
      "missing_required": [],
      "warnings": []
    }
  }
}